{
  "code": "BMMJ17",
  "category": "BMMJ",
  "title": "BMMJ17",
  "alarm_message": "Sealing Top lock SW2 Fail",
  "description": "This alarm occurs when machine is started and sealing station top plate dose not activate. Sealing station top plate may not ativate if it is obstructed by side lock cylinder or the top plate cylinder failed to work or if the top reed switch position is disturbed or not functioning. Reason & Remedy",
  "reasons_remedies": [
    "Sealing station failed to activate after machine start.",
    "Check if the sealing side lock cylinder is not blocking top plate from activating.",
    "Sealing station top plate activated reed switch not sensing the piston.",
    "Check and adjust the position of reed switch 2.",
    "Check if reed switch is tightned properly and not moving while machine is running.",
    "Reed switch not sensing.",
    "Check if reed switch is working properly by moving it up and down on clyinder. If reed switch is not functing check the wiring for any loose connection or replace the seed switch."
  ],
  "media": [
    {
      "path": "HTML/Help_Images_BMAX/SealTop.JPG",
      "type": "jpg",
      "caption": "",
      "tags": [
        "sealtop"
      ]
    }
  ],
  "text_for_embedding": "Error Code BMMJ17\nError Code 17\nCategory: BMMJ\nTitle: BMMJ17\nAlarm Message: Sealing Top lock SW2 Fail\nDescription: This alarm occurs when machine is started and sealing station top plate dose not activate. Sealing station top plate may not ativate if it is obstructed by side lock cylinder or the top plate cylinder failed to work or if the top reed switch position is disturbed or not functioning. Reason & Remedy\nReason & Remedy:\n1. Sealing station failed to activate after machine start.\n2. Check if the sealing side lock cylinder is not blocking top plate from activating.\n3. Sealing station top plate activated reed switch not sensing the piston.\n4. Check and adjust the position of reed switch 2.\n5. Check if reed switch is tightned properly and not moving while machine is running.\n6. Reed switch not sensing.\n7. Check if reed switch is working properly by moving it up and down on clyinder. If reed switch is not functing check the wiring for any loose connection or replace the seed switch.\nVisual References:",
  "notes": ""
}