{
  "code": "BMMJ16",
  "category": "BMMJ",
  "title": "BMMJ16",
  "alarm_message": "Sealing Side unlock (R) SW 5 Fail",
  "description": "This alarm occurs when machine is stoped and sealing station side lock cylinder(Right) fails to retun to home position. Side lock cylinder(Right) may not return t home position if cylinder failed to work or if the reed switch position is disturbed or not functioning. Reason & Remedy",
  "reasons_remedies": [
    "Side lock cylinder(Right) falied toreturn to home position.",
    "Check if the sealing side lock cylinder is completly retracted and nothing is blocking it.",
    "Check the pneumatic air pressre. Minimum 4 bar is reqired.",
    "Side lock cylinder(Right) retracted but reed switch not sensing the piston.",
    "Check and adjust the position of reed switch 3.",
    "Check if reed switch is tightned properly and not moving while machine is running.",
    "Reed switch not sensing.",
    "Check if reed switch is working properly by moving it up and down on clyinder. If reed switch is not functing check the wiring for any loose connection or replace the seed switch."
  ],
  "media": [
    {
      "path": "HTML/Help_Images_BMAX/SealSideRight.JPG",
      "type": "jpg",
      "caption": "",
      "tags": [
        "sealsideright"
      ]
    }
  ],
  "text_for_embedding": "Error Code BMMJ16\nError Code 16\nCategory: BMMJ\nTitle: BMMJ16\nAlarm Message: Sealing Side unlock (R) SW 5 Fail\nDescription: This alarm occurs when machine is stoped and sealing station side lock cylinder(Right) fails to retun to home position. Side lock cylinder(Right) may not return t home position if cylinder failed to work or if the reed switch position is disturbed or not functioning. Reason & Remedy\nReason & Remedy:\n1. Side lock cylinder(Right) falied toreturn to home position.\n2. Check if the sealing side lock cylinder is completly retracted and nothing is blocking it.\n3. Check the pneumatic air pressre. Minimum 4 bar is reqired.\n4. Side lock cylinder(Right) retracted but reed switch not sensing the piston.\n5. Check and adjust the position of reed switch 3.\n6. Check if reed switch is tightned properly and not moving while machine is running.\n7. Reed switch not sensing.\n8. Check if reed switch is working properly by moving it up and down on clyinder. If reed switch is not functing check the wiring for any loose connection or replace the seed switch.\nVisual References:",
  "notes": ""
}