{
  "code": "BMMJ15",
  "category": "BMMJ",
  "title": "BMMJ15",
  "alarm_message": "Sealing Side Lock (R) SW 6 Fail",
  "description": "This alarm occurs when machine is started and sealing station side lock cylinder(Right) dose not activate and lock. Side lock cylinder(Right) may not activate if cylinder failed to work or if the reed switch position is disturbed or not functioning. Reason & Remedy",
  "reasons_remedies": [
    "Side lock cylinder(Right) falied to activate when machine was started.",
    "Check if the sealing side lock cylinder is completly activated and nothing is blocking it.",
    "Check the pneumatic air pressre. Minimum 4 bar is reqired.",
    "Side lock cylinder(Right) activated but reed switch not sensing the piston.",
    "Check and adjust the position of reed switch 6.",
    "Check if reed switch is tightned properly and not moving while machine is running.",
    "Reed switch not sensing.",
    "Check if reed switch is working properly by moving it up and down on clyinder. If reed switch is not functing check the wiring for any loose connection or replace the seed switch."
  ],
  "media": [
    {
      "path": "HTML/Help_Images_BMAX/SealSideRight.JPG",
      "type": "jpg",
      "caption": "",
      "tags": [
        "sealsideright"
      ]
    }
  ],
  "text_for_embedding": "Error Code BMMJ15\nError Code 15\nCategory: BMMJ\nTitle: BMMJ15\nAlarm Message: Sealing Side Lock (R) SW 6 Fail\nDescription: This alarm occurs when machine is started and sealing station side lock cylinder(Right) dose not activate and lock. Side lock cylinder(Right) may not activate if cylinder failed to work or if the reed switch position is disturbed or not functioning. Reason & Remedy\nReason & Remedy:\n1. Side lock cylinder(Right) falied to activate when machine was started.\n2. Check if the sealing side lock cylinder is completly activated and nothing is blocking it.\n3. Check the pneumatic air pressre. Minimum 4 bar is reqired.\n4. Side lock cylinder(Right) activated but reed switch not sensing the piston.\n5. Check and adjust the position of reed switch 6.\n6. Check if reed switch is tightned properly and not moving while machine is running.\n7. Reed switch not sensing.\n8. Check if reed switch is working properly by moving it up and down on clyinder. If reed switch is not functing check the wiring for any loose connection or replace the seed switch.\nVisual References:",
  "notes": ""
}