{
  "code": "BMMJ12",
  "category": "BMMJ",
  "title": "BMMJ12",
  "alarm_message": "Sealing Top unlock SW 1 Fail",
  "description": "This alarm occurs when machine is stopped and sealing station top plate dose not return to its home position. Sealing station top plate may not return to home position if it is obstructed by side lock cylinder or the top plate cylinder failed to work or if the top reed switch position is disturbed or not functioning. Reason & Remedy",
  "reasons_remedies": [
    "Sealing station failed to unlock after machine stop.",
    "Check if the sealing side lock cylinder is retracted completly and are not blocking top plate from going up.",
    "Sealing station opened but reed switch not sensing the piston.",
    "Check and adjust the position of reed switch 1.",
    "Check if reed switch is tightned properly and not moving while machine is running.",
    "Reed switch not sensing.",
    "Check if reed switch is working properly by moving it up and down on clyinder. If reed switch is not functing check the wiring for any loose connection or replace the seed switch."
  ],
  "media": [
    {
      "path": "HTML/Help_Images_BMAX/SealTop.JPG",
      "type": "jpg",
      "caption": "",
      "tags": [
        "sealtop"
      ]
    }
  ],
  "text_for_embedding": "Error Code BMMJ12\nError Code 12\nCategory: BMMJ\nTitle: BMMJ12\nAlarm Message: Sealing Top unlock SW 1 Fail\nDescription: This alarm occurs when machine is stopped and sealing station top plate dose not return to its home position. Sealing station top plate may not return to home position if it is obstructed by side lock cylinder or the top plate cylinder failed to work or if the top reed switch position is disturbed or not functioning. Reason & Remedy\nReason & Remedy:\n1. Sealing station failed to unlock after machine stop.\n2. Check if the sealing side lock cylinder is retracted completly and are not blocking top plate from going up.\n3. Sealing station opened but reed switch not sensing the piston.\n4. Check and adjust the position of reed switch 1.\n5. Check if reed switch is tightned properly and not moving while machine is running.\n6. Reed switch not sensing.\n7. Check if reed switch is working properly by moving it up and down on clyinder. If reed switch is not functing check the wiring for any loose connection or replace the seed switch.\nVisual References:",
  "notes": ""
}